{
  "$schema": "https://json-schema.org/draft/2020-12/schema",
  "$id": "https://raw.githubusercontent.com/api-evangelist/pokeapi/refs/heads/main/json-schema/pokeapi-move-schema.json",
  "title": "Move",
  "description": "Pok\u00e9API Move schema.",
  "type": "object",
  "properties": {
    "id": {
      "type": "integer"
    },
    "name": {
      "type": "string"
    },
    "accuracy": {
      "type": "integer",
      "nullable": true
    },
    "effect_chance": {
      "type": "integer",
      "nullable": true
    },
    "pp": {
      "type": "integer"
    },
    "priority": {
      "type": "integer"
    },
    "power": {
      "type": "integer",
      "nullable": true
    },
    "contest_combos": {
      "type": "object",
      "nullable": true
    },
    "contest_type": {
      "type": "object",
      "properties": {
        "name": {
          "type": "string",
          "description": "Slug name of the referenced resource."
        },
        "url": {
          "type": "string",
          "format": "uri",
          "description": "Canonical URL of the referenced resource."
        }
      }
    },
    "contest_effect": {
      "type": "object",
      "properties": {
        "name": {
          "type": "string",
          "description": "Slug name of the referenced resource."
        },
        "url": {
          "type": "string",
          "format": "uri",
          "description": "Canonical URL of the referenced resource."
        }
      }
    },
    "damage_class": {
      "type": "object",
      "properties": {
        "name": {
          "type": "string",
          "description": "Slug name of the referenced resource."
        },
        "url": {
          "type": "string",
          "format": "uri",
          "description": "Canonical URL of the referenced resource."
        }
      }
    },
    "effect_entries": {
      "type": "array",
      "items": {
        "type": "object"
      }
    },
    "flavor_text_entries": {
      "type": "array",
      "items": {
        "type": "object",
        "properties": {
          "flavor_text": {
            "type": "string"
          },
          "language": {
            "type": "object",
            "properties": {
              "name": {
                "type": "string",
                "description": "Slug name of the referenced resource."
              },
              "url": {
                "type": "string",
                "format": "uri",
                "description": "Canonical URL of the referenced resource."
              }
            }
          },
          "version": {
            "type": "object",
            "properties": {
              "name": {
                "type": "string",
                "description": "Slug name of the referenced resource."
              },
              "url": {
                "type": "string",
                "format": "uri",
                "description": "Canonical URL of the referenced resource."
              }
            }
          }
        }
      }
    },
    "generation": {
      "type": "object",
      "properties": {
        "name": {
          "type": "string",
          "description": "Slug name of the referenced resource."
        },
        "url": {
          "type": "string",
          "format": "uri",
          "description": "Canonical URL of the referenced resource."
        }
      }
    },
    "meta": {
      "type": "object"
    },
    "names": {
      "type": "array",
      "items": {
        "type": "object",
        "properties": {
          "name": {
            "type": "string"
          },
          "language": {
            "type": "object",
            "properties": {
              "name": {
                "type": "string",
                "description": "Slug name of the referenced resource."
              },
              "url": {
                "type": "string",
                "format": "uri",
                "description": "Canonical URL of the referenced resource."
              }
            }
          }
        }
      }
    },
    "target": {
      "type": "object",
      "properties": {
        "name": {
          "type": "string",
          "description": "Slug name of the referenced resource."
        },
        "url": {
          "type": "string",
          "format": "uri",
          "description": "Canonical URL of the referenced resource."
        }
      }
    },
    "type": {
      "type": "object",
      "properties": {
        "name": {
          "type": "string",
          "description": "Slug name of the referenced resource."
        },
        "url": {
          "type": "string",
          "format": "uri",
          "description": "Canonical URL of the referenced resource."
        }
      }
    }
  }
}